{
  "schemaVersion": 1,
  "brief": {
    "schemaVersion": 1,
    "id": "vk-neighbour-exchange",
    "request": "Сделать мимикрию для ВКонтакте, которая помогает соседям обмениваться редко нужными вещами без общего шумного чата",
    "audience": {
      "primary": "Жители больших многоквартирных домов, готовые помогать соседям в пределах короткой прогулки",
      "needs": [
        "Быстро найти редкую бытовую вещь на один вечер",
        "Понимать, кому можно доверить свою вещь и когда она вернётся"
      ],
      "exclusions": [
        "Профессиональные арендодатели",
        "Публичная доска объявлений всего города"
      ]
    },
    "context": {
      "situations": [
        "Перед домашней задачей выясняется, что нужный инструмент покупать ради одного раза неразумно",
        "Сосед готов одолжить вещь, если понятны человек, срок и способ возврата"
      ],
      "constraints": [
        "Ценность должна появиться в пределах одного дома до роста большой сети",
        "Разрешения запрашиваются только из понятного пользовательского действия",
        "Нельзя выдавать fixture evidence за реальные исследования"
      ]
    },
    "reference": {
      "strategy": "mimicry",
      "family": "vk-family",
      "profileId": "vk-ios"
    },
    "permissions": [
      {
        "key": "camera",
        "priority": "required",
        "constraint": "Нужна только для фотографии конкретной предлагаемой вещи"
      },
      {
        "key": "location",
        "priority": "required",
        "constraint": "Нужна для выбора ближайшего дома; адрес можно выбрать вручную"
      },
      {
        "key": "push",
        "priority": "required",
        "constraint": "Нужна после подписки на запрос или подтверждения выдачи"
      }
    ],
    "candidateCount": 3
  },
  "candidates": [
    {
      "schemaVersion": 1,
      "id": "borrow-circle",
      "name": "Круг",
      "productThesis": "Соседи закрывают редкую бытовую задачу через одно обещание выдать и вернуть вещь, а не через бесконечный общий чат.",
      "insight": {
        "claim": "Для редкой вещи главная стоимость — не цена, а неопределённость, у кого она есть и когда её вернут.",
        "evidenceRefs": [
          "brief-observation"
        ]
      },
      "job": {
        "actor": "A resident with an immediate bounded household need",
        "situation": "The need appears before a task at home",
        "motivation": "Avoid buying or coordinating more than the task requires",
        "outcome": "Borrow a nearby item with a clear handoff and return promise"
      },
      "wedge": {
        "audience": "Residents of one dense apartment building",
        "situation": "A need can be fulfilled within a short walk and clear return window",
        "mechanism": "A time-bounded borrow request becomes a two-party commitment with handoff and return states"
      },
      "observableDifferentiation": {
        "kind": "behavior",
        "behavior": "People move from a relevant request to a tracked handoff and return instead of continuing an open chat",
        "comparator": "An unstructured neighbourhood chat or city-wide classifieds feed",
        "measurement": "Share of opened units that reach a named commitment and completed outcome",
        "threshold": "At least one in four relevant opens creates a commitment in the pilot",
        "experiment": "Run a four-week two-house pilot and compare completion with the existing house chat",
        "coreLoopStep": "Open a relevant borrow request and accept one bounded handoff",
        "evidenceRefs": [
          "brief-observation"
        ]
      },
      "valueExchange": {
        "userGives": [
          "Close the return and publish availability for a future neighbour",
          "A clear time or availability constraint"
        ],
        "userGets": [
          "Borrow a nearby item with a clear handoff and return promise",
          "A visible accountable next step"
        ]
      },
      "contentModel": {
        "primaryUnit": "Borrow request",
        "relationships": [
          "Borrow request belongs to one House",
          "Borrow request links a requester, responder, and Commitment"
        ]
      },
      "contentSupply": {
        "coldStartSources": [
          "House stewards seed verified Borrow request examples with explicit consent"
        ],
        "ongoingSources": [
          "Residents publish available items after a successful return or from an unresolved request"
        ],
        "contributorIncentives": [
          "A completed outcome lowers the next neighbour's coordination cost",
          "Contribution improves reciprocal access"
        ],
        "qualityControls": [
          "One-house visibility",
          "Expiry and duplicate detection",
          "Reporting and commitment history"
        ]
      },
      "socialGraphLeverage": {
        "relationship": "Verified residents and their direct reciprocal commitments",
        "mechanism": "Identity and completion history reduce uncertainty without a public popularity score",
        "valueWithoutGraph": "Seeded current units and manual house choice provide first-session value before friend matches"
      },
      "coldStart": {
        "firstSessionValue": "Browse current Borrow request examples and complete one bounded task",
        "seededContent": "Consent-based representative Borrow request entries for the pilot house",
        "emptyStateAction": "Create the first Borrow request with a guided constraint form"
      },
      "activation": {
        "moment": "A resident reaches a commitment with a named counterparty and time",
        "signal": "commitment_started with both parties confirmed",
        "window": "First seven days after joining a House"
      },
      "coreLoop": {
        "trigger": "A bounded household need or completed reciprocal action",
        "action": "Open a relevant borrow request and accept one bounded handoff",
        "reward": "Borrow a nearby item with a clear handoff and return promise",
        "contribution": "Close the return and publish availability for a future neighbour",
        "hypothesis": "Visible completion makes the next relevant contribution more likely",
        "successMetric": "Second completed commitment or contribution within 30 days",
        "testPlan": "Pilot two houses and inspect cohort completion plus qualitative failure reasons",
        "evidenceRefs": [
          "brief-observation"
        ]
      },
      "habitLoop": {
        "cue": "A relevant nearby need or return deadline",
        "routine": "Open a relevant borrow request and accept one bounded handoff",
        "reward": "The task closes with less purchase and coordination",
        "frequency": "Event-driven, measured by house rather than assumed daily"
      },
      "retention": {
        "reasons": [
          "Open commitments need closure",
          "New relevant units appear within one House",
          "Reciprocity makes future access easier"
        ],
        "leadingIndicators": [
          "Commitment completion",
          "Contribution after receiving value",
          "Second relevant open within 30 days"
        ]
      },
      "permissions": [
        {
          "key": "camera",
          "productValue": "Publish one photo of the concrete item or place involved",
          "flow": "Create contribution from the relevant detail flow",
          "requestMoment": "Tap Add a current photo in the composer",
          "deniedFallback": "Publish a text description and category without a photo",
          "role": "core"
        },
        {
          "key": "location",
          "productValue": "Choose the nearest relevant house without exposing continuous movement",
          "flow": "Select house before entering its scoped feed",
          "requestMoment": "Tap Use my location on house selection",
          "deniedFallback": "Search and select the address manually",
          "role": "supporting"
        },
        {
          "key": "push",
          "productValue": "Receive the answer or commitment the person explicitly follows",
          "flow": "Follow one request or confirm one commitment",
          "requestMoment": "Tap Notify me about this request",
          "deniedFallback": "Show unread state and updates inside the product inbox",
          "role": "supporting"
        }
      ],
      "trustSafety": {
        "risks": [
          "Unsafe in-person handoff",
          "Theft or harassment",
          "Disclosure of a precise apartment"
        ],
        "controls": [
          "House-scoped identity",
          "Neutral handoff location",
          "Block/report and commitment cancellation"
        ],
        "reporting": "Report remains attached to the person and commitment, with an emergency exit from the flow"
      },
      "privacy": {
        "data": [
          "Selected House, not continuous movement history",
          "Product contribution and commitment state",
          "Optional item photo"
        ],
        "principles": [
          "Minimise address precision",
          "Request access at the causal action",
          "Keep denied fallback equivalent where possible"
        ],
        "retention": "Expire location-derived selection immediately; retain commitments only for the declared dispute window"
      },
      "businessLogic": {
        "model": "House-level partner sponsorship after product value is proven",
        "payer": "Property operator or local partner, never the resident seeking help",
        "value": "Lower duplicated purchases and unresolved household coordination",
        "viabilitySignal": "Completed commitments per funded House exceed operating and moderation cost",
        "constraints": "No paywall on safety, reporting, or return completion"
      },
      "nonGoals": [
        "City-wide marketplace",
        "Anonymous public chat",
        "Professional rental inventory"
      ],
      "risks": [
        {